rule_id,rule_name,rule_type,support_basis,evidence_ids,evidence_refs,generator_use,validation_use,scope_note,evidence_summary,source_urls
CL1,radiation_monotonicity,hard_process_rule,observed_design; literature_compatible,E03; E05; E06,"E03 (PMID 26245485, 2015); E05 (PMID 28574821, 2017); E06 (PMID 32138173, 2020)",Monotone projection forces non-increasing survival along the radiation axis at each thermal condition.,Checked by `radiation_monotonicity_mean_rate` on grouped exact-design means.,Cell-level hard process rule.,"E03: Hyperthermia perturbs multiple DNA repair pathways including HR and NHEJ-related components | E05: HR inhibition and radiosensitization depend on thermal dose; 41-43 C for about 30-60 min is a key sensitizing range | E06: Shorter interval caused more residual DNA damage, more apoptosis, and more cell kill; sequence had little effect",https://pmc.ncbi.nlm.nih.gov/articles/PMC4554295/; https://pubmed.ncbi.nlm.nih.gov/28574821/; https://pubmed.ncbi.nlm.nih.gov/32138173/
CL2,sensitizing_window,soft_mechanistic_rule,literature_anchor,E03; E04; E05,"E03 (PMID 26245485, 2015); E04 (PMID 21555554, 2011); E05 (PMID 28574821, 2017)",Used as a scope rule: the active generator keeps the 41-43 C / 30-60 min sensitizing interpretation but does not invent extra covariates.,Not validated as an independent hard check because it is mechanistic and partly latent; documented as scope and interpretation.,Cell-level mechanistic rule retained from in vitro DNA-repair literature.,E03: Hyperthermia perturbs multiple DNA repair pathways including HR and NHEJ-related components | E04: Mild hyperthermia inhibits homologous recombination and induces BRCA2 degradation | E05: HR inhibition and radiosensitization depend on thermal dose; 41-43 C for about 30-60 min is a key sensitizing range,https://pmc.ncbi.nlm.nih.gov/articles/PMC4554295/; https://pubmed.ncbi.nlm.nih.gov/21555554/; https://pubmed.ncbi.nlm.nih.gov/28574821/
CL3,thermal_ordering_in_observed_domain,hard_article_guided_rule,observed_design; literature_compatible,E03; E05,"E03 (PMID 26245485, 2015); E05 (PMID 28574821, 2017)",Monotone projection also preserves thermal ordering in the observed domain: 42C_45min >= 43C_45min >= 44C_30min.,Checked by `thermal_monotonicity_mean_rate` on grouped exact-design means.,Observed-domain ordering rule for this exact 15-point matrix.,E03: Hyperthermia perturbs multiple DNA repair pathways including HR and NHEJ-related components | E05: HR inhibition and radiosensitization depend on thermal dose; 41-43 C for about 30-60 min is a key sensitizing range,https://pmc.ncbi.nlm.nih.gov/articles/PMC4554295/; https://pubmed.ncbi.nlm.nih.gov/28574821/
CL4,high_temperature_direct_cytotoxicity,soft_to_hard_rule_in_domain,literature_anchor; observed_design,E01; E05; E14,"E01 (PMID 7146320, 1982); E05 (PMID 28574821, 2017); E14 (PMID NA, 2002)",Supports treating 44C_30min as the strongest thermal condition in the observed domain and prevents biologically softer 44 C outcomes.,Interpreted through the thermal ordering check and design-point explanations for 44C_30min.,Mechanistic temperature-shift rule restricted to the observed domain.,"E01: Around 40 C tumor oxygenation improved, while higher temperatures reduced oxygenation because of vascular restriction | E05: HR inhibition and radiosensitization depend on thermal dose; 41-43 C for about 30-60 min is a key sensitizing range | E14: The cytotoxic threshold for hyperthermia was described around 42.5 C and the critical temperature for cell-killing curves was between 42.5 C and 43 C",https://pubmed.ncbi.nlm.nih.gov/7146320/; https://pubmed.ncbi.nlm.nih.gov/28574821/; https://www.ncbi.nlm.nih.gov/books/NBK6245/
CL5,high_combined_dose_low_survival,hard_plausibility_rule,observed_design; literature_compatible,E05; E06,"E05 (PMID 28574821, 2017); E06 (PMID 32138173, 2020)",High-combined-dose cells are capped to very low survival for radiation >= 6 Gy and CEM43 >= 45.,Checked by `high_combined_dose_low_survival_rate` on observable columns only.,Project-level hard plausibility rule supported by the most damaging combinations in the observed matrix.,"E05: HR inhibition and radiosensitization depend on thermal dose; 41-43 C for about 30-60 min is a key sensitizing range | E06: Shorter interval caused more residual DNA damage, more apoptosis, and more cell kill; sequence had little effect",https://pubmed.ncbi.nlm.nih.gov/28574821/; https://pubmed.ncbi.nlm.nih.gov/32138173/
